"* La Paz County, AZ was separated from Yuma County on January 1, 1983. The Yuma, AZ MSA contains the area that became La Paz County, AZ through 1982 and excludes it beginning with 1983."
"* Broomfield County, CO, was created from parts of Adams, Boulder, Jefferson, and Weld counties effective November 15, 2001. Estimates for Broomfield county begin with 2002."
"* Cibola, NM was separated from Valencia in June 1981, but in these estimates, Valencia includes Cibola through the end of 1981."
"* Virginia combination areas consist of one or two independent cities with 1980 populations of less than 100,000 combined with an adjacent county. The county name appears first, followed by the city name(s). Separate estimates for the jurisdictions making up the combination area are not available. Bedford County, VA includes the independent city of Bedford for all years."
"  Metropolitan Areas are defined (geographically delineated) by the Office of Management and Budget (OMB) bulletin no. 20-01 issued March 6, 2020."
Note. All dollar estimates are in thousands of current dollars (not adjusted for inflation). Statistics presented in thousands of dollars do not indicate more precision than statistics presented in millions of dollars.
"  Last updated: November 14, 2024-- new statistics for 2023; revised statistics for 2019-2022."
