GeoFips,GeoName,Value
00998,United States,100.595
10180,"Abilene, TX (Metropolitan Statistical Area)",75.409
10420,"Akron, OH (Metropolitan Statistical Area)",76.598
10500,"Albany, GA (Metropolitan Statistical Area)",50.431
10540,"Albany-Lebanon, OR (Metropolitan Statistical Area)",98.988
10580,"Albany-Schenectady-Troy, NY (Metropolitan Statistical Area)",92.49
10740,"Albuquerque, NM (Metropolitan Statistical Area)",88.663
10780,"Alexandria, LA (Metropolitan Statistical Area)",48.026
10900,"Allentown-Bethlehem-Easton, PA-NJ (Metropolitan Statistical Area)",102.924
11020,"Altoona, PA (Metropolitan Statistical Area)",53.618
11100,"Amarillo, TX (Metropolitan Statistical Area)",74.712
11180,"Ames, IA (Metropolitan Statistical Area)",65.712
11260,"Anchorage, AK (Metropolitan Statistical Area)",112.895
11460,"Ann Arbor, MI (Metropolitan Statistical Area)",113.923
11500,"Anniston-Oxford, AL (Metropolitan Statistical Area)",44.749
11540,"Appleton, WI (Metropolitan Statistical Area)",75.213
11700,"Asheville, NC (Metropolitan Statistical Area)",83.918
12020,"Athens-Clarke County, GA (Metropolitan Statistical Area)",75.794
12060,"Atlanta-Sandy Springs-Alpharetta, GA (Metropolitan Statistical Area)",107.381
12100,"Atlantic City-Hammonton, NJ (Metropolitan Statistical Area)",105.025
12220,"Auburn-Opelika, AL (Metropolitan Statistical Area)",60.605
12260,"Augusta-Richmond County, GA-SC (Metropolitan Statistical Area)",69.119
12420,"Austin-Round Rock-Georgetown, TX (Metropolitan Statistical Area)",126.394
12540,"Bakersfield, CA (Metropolitan Statistical Area)",93.159
12580,"Baltimore-Columbia-Towson, MD (Metropolitan Statistical Area)",120.495
12620,"Bangor, ME (Metropolitan Statistical Area)",63.43
12700,"Barnstable Town, MA (Metropolitan Statistical Area)",125.316
12940,"Baton Rouge, LA (Metropolitan Statistical Area)",75.672
12980,"Battle Creek, MI (Metropolitan Statistical Area)",62.523
13020,"Bay City, MI (Metropolitan Statistical Area)",53.27
13140,"Beaumont-Port Arthur, TX (Metropolitan Statistical Area)",72.551
13220,"Beckley, WV (Metropolitan Statistical Area)",52.42
13380,"Bellingham, WA (Metropolitan Statistical Area)",109.501
13460,"Bend, OR (Metropolitan Statistical Area)",118.283
13740,"Billings, MT (Metropolitan Statistical Area)",81.919
13780,"Binghamton, NY (Metropolitan Statistical Area)",70.708
13820,"Birmingham-Hoover, AL (Metropolitan Statistical Area)",70.425
13900,"Bismarck, ND (Metropolitan Statistical Area)",78.767
13980,"Blacksburg-Christiansburg, VA (Metropolitan Statistical Area)",75.973
14010,"Bloomington, IL (Metropolitan Statistical Area)",78.176
14020,"Bloomington, IN (Metropolitan Statistical Area)",80.88
14100,"Bloomsburg-Berwick, PA (Metropolitan Statistical Area)",54.858
14260,"Boise City, ID (Metropolitan Statistical Area)",102.47
14460,"Boston-Cambridge-Newton, MA-NH (Metropolitan Statistical Area)",150.302
14500,"Boulder, CO (Metropolitan Statistical Area)",150.559
14540,"Bowling Green, KY (Metropolitan Statistical Area)",63.322
14740,"Bremerton-Silverdale-Port Orchard, WA (Metropolitan Statistical Area)",130.281
14860,"Bridgeport-Stamford-Norwalk, CT (Metropolitan Statistical Area)",153.402
15180,"Brownsville-Harlingen, TX (Metropolitan Statistical Area)",54.33
15260,"Brunswick, GA (Metropolitan Statistical Area)",68.69
15380,"Buffalo-Cheektowaga, NY (Metropolitan Statistical Area)",78.656
15500,"Burlington, NC (Metropolitan Statistical Area)",70.729
15540,"Burlington-South Burlington, VT (Metropolitan Statistical Area)",123.734
15680,"California-Lexington Park, MD (Metropolitan Statistical Area)",109.725
15940,"Canton-Massillon, OH (Metropolitan Statistical Area)",58.076
15980,"Cape Coral-Fort Myers, FL (Metropolitan Statistical Area)",123.224
16020,"Cape Girardeau, MO-IL (Metropolitan Statistical Area)",58.129
16060,"Carbondale-Marion, IL (Metropolitan Statistical Area)",53.465
16180,"Carson City, NV (Metropolitan Statistical Area)",98.265
16220,"Casper, WY (Metropolitan Statistical Area)",78.985
16300,"Cedar Rapids, IA (Metropolitan Statistical Area)",75.877
16540,"Chambersburg-Waynesboro, PA (Metropolitan Statistical Area)",74.712
16580,"Champaign-Urbana, IL (Metropolitan Statistical Area)",73.293
16620,"Charleston, WV (Metropolitan Statistical Area)",50.224
16700,"Charleston-North Charleston, SC (Metropolitan Statistical Area)",110.987
16740,"Charlotte-Concord-Gastonia, NC-SC (Metropolitan Statistical Area)",93.908
16820,"Charlottesville, VA (Metropolitan Statistical Area)",97.39
16860,"Chattanooga, TN-GA (Metropolitan Statistical Area)",79.655
16940,"Cheyenne, WY (Metropolitan Statistical Area)",94.118
16980,"Chicago-Naperville-Elgin, IL-IN-WI (Metropolitan Statistical Area)",110.883
17020,"Chico, CA (Metropolitan Statistical Area)",91.37
17140,"Cincinnati, OH-KY-IN (Metropolitan Statistical Area)",83.722
17300,"Clarksville, TN-KY (Metropolitan Statistical Area)",73.98
17420,"Cleveland, TN (Metropolitan Statistical Area)",64.999
17460,"Cleveland-Elyria, OH (Metropolitan Statistical Area)",82.729
17660,"Coeur d'Alene, ID (Metropolitan Statistical Area)",99.719
17780,"College Station-Bryan, TX (Metropolitan Statistical Area)",79.836
17820,"Colorado Springs, CO (Metropolitan Statistical Area)",119.462
17860,"Columbia, MO (Metropolitan Statistical Area)",64.971
17900,"Columbia, SC (Metropolitan Statistical Area)",78.876
17980,"Columbus, GA-AL (Metropolitan Statistical Area)",60.931
18020,"Columbus, IN (Metropolitan Statistical Area)",66.458
18140,"Columbus, OH (Metropolitan Statistical Area)",87.646
18580,"Corpus Christi, TX (Metropolitan Statistical Area)",86.41
18700,"Corvallis, OR (Metropolitan Statistical Area)",106.401
18880,"Crestview-Fort Walton Beach-Destin, FL (Metropolitan Statistical Area)",99.138
19060,"Cumberland, MD-WV (Metropolitan Statistical Area)",52.942
19100,"Dallas-Fort Worth-Arlington, TX (Metropolitan Statistical Area)",116.302
19140,"Dalton, GA (Metropolitan Statistical Area)",63.227
19180,"Danville, IL (Metropolitan Statistical Area)",57.307
19300,"Daphne-Fairhope-Foley, AL (Metropolitan Statistical Area)",75.226
19340,"Davenport-Moline-Rock Island, IA-IL (Metropolitan Statistical Area)",68.715
19430,"Dayton-Kettering, OH (Metropolitan Statistical Area)",72.851
19460,"Decatur, AL (Metropolitan Statistical Area)",55.371
19500,"Decatur, IL (Metropolitan Statistical Area)",56.621
19660,"Deltona-Daytona Beach-Ormond Beach, FL (Metropolitan Statistical Area)",105.02
19740,"Denver-Aurora-Lakewood, CO (Metropolitan Statistical Area)",145.767
19780,"Des Moines-West Des Moines, IA (Metropolitan Statistical Area)",87.533
19820,"Detroit-Warren-Dearborn, MI (Metropolitan Statistical Area)",94.26
20020,"Dothan, AL (Metropolitan Statistical Area)",47.87
20100,"Dover, DE (Metropolitan Statistical Area)",81.541
20220,"Dubuque, IA (Metropolitan Statistical Area)",61.448
20260,"Duluth, MN-WI (Metropolitan Statistical Area)",74.634
20500,"Durham-Chapel Hill, NC (Metropolitan Statistical Area)",91.43
20700,"East Stroudsburg, PA (Metropolitan Statistical Area)",80.037
20740,"Eau Claire, WI (Metropolitan Statistical Area)",71.69
20940,"El Centro, CA (Metropolitan Statistical Area)",73.97
21060,"Elizabethtown-Fort Knox, KY (Metropolitan Statistical Area)",58.872
21140,"Elkhart-Goshen, IN (Metropolitan Statistical Area)",72.962
21300,"Elmira, NY (Metropolitan Statistical Area)",74.349
21340,"El Paso, TX (Metropolitan Statistical Area)",73.399
21420,"Enid, OK (Metropolitan Statistical Area) *",50.101
21500,"Erie, PA (Metropolitan Statistical Area)",61.561
21660,"Eugene-Springfield, OR (Metropolitan Statistical Area)",99.512
21780,"Evansville, IN-KY (Metropolitan Statistical Area)",60
21820,"Fairbanks, AK (Metropolitan Statistical Area)",79.903
22020,"Fargo, ND-MN (Metropolitan Statistical Area)",63.475
22140,"Farmington, NM (Metropolitan Statistical Area)",66.999
22180,"Fayetteville, NC (Metropolitan Statistical Area)",67.412
22220,"Fayetteville-Springdale-Rogers, AR (Metropolitan Statistical Area)",71.832
22380,"Flagstaff, AZ (Metropolitan Statistical Area)",99.733
22420,"Flint, MI (Metropolitan Statistical Area)",68.65
22500,"Florence, SC (Metropolitan Statistical Area)",54.196
22520,"Florence-Muscle Shoals, AL (Metropolitan Statistical Area)",45.789
22540,"Fond du Lac, WI (Metropolitan Statistical Area)",62.888
22660,"Fort Collins, CO (Metropolitan Statistical Area)",130.329
22900,"Fort Smith, AR-OK (Metropolitan Statistical Area)",51.137
23060,"Fort Wayne, IN (Metropolitan Statistical Area)",79.494
23420,"Fresno, CA (Metropolitan Statistical Area)",96.299
23460,"Gadsden, AL (Metropolitan Statistical Area)",42.684
23540,"Gainesville, FL (Metropolitan Statistical Area)",89.527
23580,"Gainesville, GA (Metropolitan Statistical Area)",94.664
23900,"Gettysburg, PA (Metropolitan Statistical Area)",85.335
24020,"Glens Falls, NY (Metropolitan Statistical Area)",73.6
24140,"Goldsboro, NC (Metropolitan Statistical Area)",59.136
24220,"Grand Forks, ND-MN (Metropolitan Statistical Area)",58.616
24260,"Grand Island, NE (Metropolitan Statistical Area)",57.937
24300,"Grand Junction, CO (Metropolitan Statistical Area)",96.356
24340,"Grand Rapids-Kentwood, MI (Metropolitan Statistical Area)",87.352
24420,"Grants Pass, OR (Metropolitan Statistical Area)",90.441
24500,"Great Falls, MT (Metropolitan Statistical Area)",78.212
24540,"Greeley, CO (Metropolitan Statistical Area)",104.201
24580,"Green Bay, WI (Metropolitan Statistical Area)",68.838
24660,"Greensboro-High Point, NC (Metropolitan Statistical Area)",71.158
24780,"Greenville, NC (Metropolitan Statistical Area)",56.699
24860,"Greenville-Anderson, SC (Metropolitan Statistical Area)",76.184
25060,"Gulfport-Biloxi, MS (Metropolitan Statistical Area)",62.51
25180,"Hagerstown-Martinsburg, MD-WV (Metropolitan Statistical Area)",73.243
25220,"Hammond, LA (Metropolitan Statistical Area)",64.614
25260,"Hanford-Corcoran, CA (Metropolitan Statistical Area)",82.153
25420,"Harrisburg-Carlisle, PA (Metropolitan Statistical Area)",87.256
25500,"Harrisonburg, VA (Metropolitan Statistical Area)",83.605
25540,"Hartford-East Hartford-Middletown, CT (Metropolitan Statistical Area)",108.222
25620,"Hattiesburg, MS (Metropolitan Statistical Area)",64.154
25860,"Hickory-Lenoir-Morganton, NC (Metropolitan Statistical Area)",59.289
25940,"Hilton Head Island-Bluffton, SC (Metropolitan Statistical Area)",109.643
25980,"Hinesville, GA (Metropolitan Statistical Area)",81.558
26140,"Homosassa Springs, FL (Metropolitan Statistical Area)",82.542
26300,"Hot Springs, AR (Metropolitan Statistical Area)",56.788
26380,"Houma-Thibodaux, LA (Metropolitan Statistical Area)",57.728
26420,"Houston-The Woodlands-Sugar Land, TX (Metropolitan Statistical Area)",108.033
26580,"Huntington-Ashland, WV-KY-OH (Metropolitan Statistical Area)",51.035
26620,"Huntsville, AL (Metropolitan Statistical Area)",76.845
26820,"Idaho Falls, ID (Metropolitan Statistical Area)",83.236
26900,"Indianapolis-Carmel-Anderson, IN (Metropolitan Statistical Area)",84.641
26980,"Iowa City, IA (Metropolitan Statistical Area)",83.398
27060,"Ithaca, NY (Metropolitan Statistical Area)",106.542
27100,"Jackson, MI (Metropolitan Statistical Area)",71.674
27140,"Jackson, MS (Metropolitan Statistical Area)",68.358
27180,"Jackson, TN (Metropolitan Statistical Area)",57.076
27260,"Jacksonville, FL (Metropolitan Statistical Area)",103.377
27340,"Jacksonville, NC (Metropolitan Statistical Area)",72.657
27500,"Janesville-Beloit, WI (Metropolitan Statistical Area)",77.018
27620,"Jefferson City, MO (Metropolitan Statistical Area)",60.114
27740,"Johnson City, TN (Metropolitan Statistical Area)",56.222
27780,"Johnstown, PA (Metropolitan Statistical Area)",51.158
27860,"Jonesboro, AR (Metropolitan Statistical Area)",54.806
27900,"Joplin, MO (Metropolitan Statistical Area)",52.438
27980,"Kahului-Wailuku-Lahaina, HI (Metropolitan Statistical Area)",115.364
28020,"Kalamazoo-Portage, MI (Metropolitan Statistical Area)",89.631
28100,"Kankakee, IL (Metropolitan Statistical Area)",76.579
28140,"Kansas City, MO-KS (Metropolitan Statistical Area)",85.603
28420,"Kennewick-Richland, WA (Metropolitan Statistical Area)",101.277
28660,"Killeen-Temple, TX (Metropolitan Statistical Area)",74.626
28700,"Kingsport-Bristol, TN-VA (Metropolitan Statistical Area)",53.872
28740,"Kingston, NY (Metropolitan Statistical Area)",110.828
28940,"Knoxville, TN (Metropolitan Statistical Area)",74.093
29020,"Kokomo, IN (Metropolitan Statistical Area)",52.491
29100,"La Crosse-Onalaska, WI-MN (Metropolitan Statistical Area)",72.352
29180,"Lafayette, LA (Metropolitan Statistical Area)",62.296
29200,"Lafayette-West Lafayette, IN (Metropolitan Statistical Area)",76.093
29340,"Lake Charles, LA (Metropolitan Statistical Area)",60.789
29420,"Lake Havasu City-Kingman, AZ (Metropolitan Statistical Area)",86.328
29460,"Lakeland-Winter Haven, FL (Metropolitan Statistical Area)",89.985
29540,"Lancaster, PA (Metropolitan Statistical Area)",92.492
29620,"Lansing-East Lansing, MI (Metropolitan Statistical Area)",85.563
29700,"Laredo, TX (Metropolitan Statistical Area)",69.705
29740,"Las Cruces, NM (Metropolitan Statistical Area)",60.183
29820,"Las Vegas-Henderson-Paradise, NV (Metropolitan Statistical Area)",112.704
29940,"Lawrence, KS (Metropolitan Statistical Area)",84.897
30020,"Lawton, OK (Metropolitan Statistical Area)",53.49
30140,"Lebanon, PA (Metropolitan Statistical Area)",72.419
30300,"Lewiston, ID-WA (Metropolitan Statistical Area)",58.569
30340,"Lewiston-Auburn, ME (Metropolitan Statistical Area)",85.788
30460,"Lexington-Fayette, KY (Metropolitan Statistical Area)",70.874
30620,"Lima, OH (Metropolitan Statistical Area)",63.155
30700,"Lincoln, NE (Metropolitan Statistical Area)",86.18
30780,"Little Rock-North Little Rock-Conway, AR (Metropolitan Statistical Area)",65.2
30860,"Logan, UT-ID (Metropolitan Statistical Area)",92.152
30980,"Longview, TX (Metropolitan Statistical Area)",54.887
31020,"Longview, WA (Metropolitan Statistical Area)",86.959
31080,"Los Angeles-Long Beach-Anaheim, CA (Metropolitan Statistical Area)",176.96
31140,"Louisville/Jefferson County, KY-IN (Metropolitan Statistical Area)",77.01
31180,"Lubbock, TX (Metropolitan Statistical Area)",74.469
31340,"Lynchburg, VA (Metropolitan Statistical Area)",65.197
31420,"Macon-Bibb County, GA (Metropolitan Statistical Area)",61.657
31460,"Madera, CA (Metropolitan Statistical Area)",84.46
31540,"Madison, WI (Metropolitan Statistical Area)",98.98
31700,"Manchester-Nashua, NH (Metropolitan Statistical Area)",132.482
31740,"Manhattan, KS (Metropolitan Statistical Area)",70.937
31860,"Mankato, MN (Metropolitan Statistical Area)",72.046
31900,"Mansfield, OH (Metropolitan Statistical Area)",58.488
32580,"McAllen-Edinburg-Mission, TX (Metropolitan Statistical Area)",57.644
32780,"Medford, OR (Metropolitan Statistical Area)",105.729
32820,"Memphis, TN-MS-AR (Metropolitan Statistical Area)",76.615
32900,"Merced, CA (Metropolitan Statistical Area)",84.111
33100,"Miami-Fort Lauderdale-Pompano Beach, FL (Metropolitan Statistical Area)",147.331
33140,"Michigan City-La Porte, IN (Metropolitan Statistical Area)",55.983
33220,"Midland, MI (Metropolitan Statistical Area)",53.27
33260,"Midland, TX (Metropolitan Statistical Area)",101.26
33340,"Milwaukee-Waukesha, WI (Metropolitan Statistical Area)",95.665
33460,"Minneapolis-St. Paul-Bloomington, MN-WI (Metropolitan Statistical Area)",119.175
33540,"Missoula, MT (Metropolitan Statistical Area)",72.452
33660,"Mobile, AL (Metropolitan Statistical Area)",56.72
33700,"Modesto, CA (Metropolitan Statistical Area)",101.596
33740,"Monroe, LA (Metropolitan Statistical Area)",50.522
33780,"Monroe, MI (Metropolitan Statistical Area)",80.673
33860,"Montgomery, AL (Metropolitan Statistical Area)",65.397
34060,"Morgantown, WV (Metropolitan Statistical Area)",69.192
34100,"Morristown, TN (Metropolitan Statistical Area)",57.402
34580,"Mount Vernon-Anacortes, WA (Metropolitan Statistical Area)",109.249
34620,"Muncie, IN (Metropolitan Statistical Area)",57.215
34740,"Muskegon, MI (Metropolitan Statistical Area)",76.219
34820,"Myrtle Beach-Conway-North Myrtle Beach, SC-NC (Metropolitan Statistical Area)",83.854
34900,"Napa, CA (Metropolitan Statistical Area)",161.471
34940,"Naples-Marco Island, FL (Metropolitan Statistical Area)",129.393
34980,"Nashville-Davidson--Murfreesboro--Franklin, TN (Metropolitan Statistical Area)",105.845
35100,"New Bern, NC (Metropolitan Statistical Area)",67.238
35300,"New Haven-Milford, CT (Metropolitan Statistical Area)",110.752
35380,"New Orleans-Metairie, LA (Metropolitan Statistical Area)",83.636
35620,"New York-Newark-Jersey City, NY-NJ-PA (Metropolitan Statistical Area)",154.156
35660,"Niles, MI (Metropolitan Statistical Area)",58.107
35840,"North Port-Sarasota-Bradenton, FL (Metropolitan Statistical Area)",123.241
35980,"Norwich-New London, CT (Metropolitan Statistical Area)",101.326
36100,"Ocala, FL (Metropolitan Statistical Area)",78.892
36140,"Ocean City, NJ (Metropolitan Statistical Area)",122.448
36220,"Odessa, TX (Metropolitan Statistical Area)",88.271
36260,"Ogden-Clearfield, UT (Metropolitan Statistical Area)",103.314
36420,"Oklahoma City, OK (Metropolitan Statistical Area)",74.531
36500,"Olympia-Lacey-Tumwater, WA (Metropolitan Statistical Area)",120.262
36540,"Omaha-Council Bluffs, NE-IA (Metropolitan Statistical Area)",87.236
36740,"Orlando-Kissimmee-Sanford, FL (Metropolitan Statistical Area)",118.581
36780,"Oshkosh-Neenah, WI (Metropolitan Statistical Area)",72.724
36980,"Owensboro, KY (Metropolitan Statistical Area)",56.597
37100,"Oxnard-Thousand Oaks-Ventura, CA (Metropolitan Statistical Area)",174.868
37340,"Palm Bay-Melbourne-Titusville, FL (Metropolitan Statistical Area)",108.691
37460,"Panama City, FL (Metropolitan Statistical Area)",96.986
37620,"Parkersburg-Vienna, WV (Metropolitan Statistical Area)",48.403
37860,"Pensacola-Ferry Pass-Brent, FL (Metropolitan Statistical Area)",84.869
37900,"Peoria, IL (Metropolitan Statistical Area)",64.07
37980,"Philadelphia-Camden-Wilmington, PA-NJ-DE-MD (Metropolitan Statistical Area)",115.828
38060,"Phoenix-Mesa-Chandler, AZ (Metropolitan Statistical Area)",122.909
38220,"Pine Bluff, AR (Metropolitan Statistical Area)",41.071
38300,"Pittsburgh, PA (Metropolitan Statistical Area)",74.852
38340,"Pittsfield, MA (Metropolitan Statistical Area)",79.796
38540,"Pocatello, ID (Metropolitan Statistical Area)",67.604
38860,"Portland-South Portland, ME (Metropolitan Statistical Area)",106.914
38900,"Portland-Vancouver-Hillsboro, OR-WA (Metropolitan Statistical Area)",128.525
38940,"Port St. Lucie, FL (Metropolitan Statistical Area)",101.482
39100,"Poughkeepsie-Newburgh-Middletown, NY (Metropolitan Statistical Area) *",121.374
39150,"Prescott Valley-Prescott, AZ (Metropolitan Statistical Area)",84.252
39300,"Providence-Warwick, RI-MA (Metropolitan Statistical Area)",98.849
39340,"Provo-Orem, UT (Metropolitan Statistical Area)",108.942
39380,"Pueblo, CO (Metropolitan Statistical Area)",78.714
39460,"Punta Gorda, FL (Metropolitan Statistical Area)",89.338
39540,"Racine, WI (Metropolitan Statistical Area)",70.892
39580,"Raleigh-Cary, NC (Metropolitan Statistical Area)",104.473
39660,"Rapid City, SD (Metropolitan Statistical Area)",80.999
39740,"Reading, PA (Metropolitan Statistical Area)",90.283
39820,"Redding, CA (Metropolitan Statistical Area)",89.656
39900,"Reno, NV (Metropolitan Statistical Area)",128.113
40060,"Richmond, VA (Metropolitan Statistical Area)",98.152
40140,"Riverside-San Bernardino-Ontario, CA (Metropolitan Statistical Area)",129.199
40220,"Roanoke, VA (Metropolitan Statistical Area)",73.356
40340,"Rochester, MN (Metropolitan Statistical Area)",91.24
40380,"Rochester, NY (Metropolitan Statistical Area)",85.234
40420,"Rockford, IL (Metropolitan Statistical Area)",69.396
40580,"Rocky Mount, NC (Metropolitan Statistical Area)",50.68
40660,"Rome, GA (Metropolitan Statistical Area)",61.743
40900,"Sacramento-Roseville-Folsom, CA (Metropolitan Statistical Area)",131.469
40980,"Saginaw, MI (Metropolitan Statistical Area)",55.001
41060,"St. Cloud, MN (Metropolitan Statistical Area)",89.473
41100,"St. George, UT (Metropolitan Statistical Area)",106.686
41140,"St. Joseph, MO-KS (Metropolitan Statistical Area)",59.275
41180,"St. Louis, MO-IL (Metropolitan Statistical Area)",79.982
41420,"Salem, OR (Metropolitan Statistical Area)",99.681
41500,"Salinas, CA (Metropolitan Statistical Area)",159.51
41540,"Salisbury, MD-DE (Metropolitan Statistical Area)",84.126
41620,"Salt Lake City, UT (Metropolitan Statistical Area)",116.484
41660,"San Angelo, TX (Metropolitan Statistical Area)",80.822
41700,"San Antonio-New Braunfels, TX (Metropolitan Statistical Area)",94.619
41740,"San Diego-Chula Vista-Carlsbad, CA (Metropolitan Statistical Area)",183.903
41860,"San Francisco-Oakland-Berkeley, CA (Metropolitan Statistical Area)",206.37
41940,"San Jose-Sunnyvale-Santa Clara, CA (Metropolitan Statistical Area)",233.264
42020,"San Luis Obispo-Paso Robles, CA (Metropolitan Statistical Area)",157.009
42100,"Santa Cruz-Watsonville, CA (Metropolitan Statistical Area)",185.002
42140,"Santa Fe, NM (Metropolitan Statistical Area)",98.882
42200,"Santa Maria-Santa Barbara, CA (Metropolitan Statistical Area)",172.181
42220,"Santa Rosa-Petaluma, CA (Metropolitan Statistical Area)",158.22
42340,"Savannah, GA (Metropolitan Statistical Area)",91.367
42540,"Scranton--Wilkes-Barre, PA (Metropolitan Statistical Area)",65.057
42660,"Seattle-Tacoma-Bellevue, WA (Metropolitan Statistical Area)",154.776
42680,"Sebastian-Vero Beach, FL (Metropolitan Statistical Area)",84.912
42700,"Sebring-Avon Park, FL (Metropolitan Statistical Area)",63.151
43100,"Sheboygan, WI (Metropolitan Statistical Area)",66.503
43300,"Sherman-Denison, TX (Metropolitan Statistical Area)",79.519
43340,"Shreveport-Bossier City, LA (Metropolitan Statistical Area)",59.612
43420,"Sierra Vista-Douglas, AZ (Metropolitan Statistical Area)",62.783
43580,"Sioux City, IA-NE-SD (Metropolitan Statistical Area)",62.938
43620,"Sioux Falls, SD (Metropolitan Statistical Area)",77.36
43780,"South Bend-Mishawaka, IN-MI (Metropolitan Statistical Area)",76.554
43900,"Spartanburg, SC (Metropolitan Statistical Area)",68.967
44060,"Spokane-Spokane Valley, WA (Metropolitan Statistical Area)",92.06
44100,"Springfield, IL (Metropolitan Statistical Area)",65.204
44140,"Springfield, MA (Metropolitan Statistical Area)",74.498
44180,"Springfield, MO (Metropolitan Statistical Area)",59.705
44220,"Springfield, OH (Metropolitan Statistical Area)",59.245
44300,"State College, PA (Metropolitan Statistical Area)",91.899
44420,"Staunton, VA (Metropolitan Statistical Area)",68.04
44700,"Stockton, CA (Metropolitan Statistical Area)",119.271
44940,"Sumter, SC (Metropolitan Statistical Area)",59.104
45060,"Syracuse, NY (Metropolitan Statistical Area)",76.205
45220,"Tallahassee, FL (Metropolitan Statistical Area)",77.703
45300,"Tampa-St. Petersburg-Clearwater, FL (Metropolitan Statistical Area)",118.62
45460,"Terre Haute, IN (Metropolitan Statistical Area)",54.515
45500,"Texarkana, TX-AR (Metropolitan Statistical Area)",50.112
45540,"The Villages, FL (Metropolitan Statistical Area)",70.15
45780,"Toledo, OH (Metropolitan Statistical Area)",66.541
45820,"Topeka, KS (Metropolitan Statistical Area)",59.6
45940,"Trenton-Princeton, NJ (Metropolitan Statistical Area)",127.313
46060,"Tucson, AZ (Metropolitan Statistical Area)",91.051
46140,"Tulsa, OK (Metropolitan Statistical Area)",70.624
46220,"Tuscaloosa, AL (Metropolitan Statistical Area)",53.625
46300,"Twin Falls, ID (Metropolitan Statistical Area) *",83.901
46340,"Tyler, TX (Metropolitan Statistical Area)",77.413
46520,"Urban Honolulu, HI (Metropolitan Statistical Area)",148.449
46540,"Utica-Rome, NY (Metropolitan Statistical Area)",62.006
46660,"Valdosta, GA (Metropolitan Statistical Area)",62.454
46700,"Vallejo, CA (Metropolitan Statistical Area)",151.429
47020,"Victoria, TX (Metropolitan Statistical Area)",73.538
47220,"Vineland-Bridgeton, NJ (Metropolitan Statistical Area)",74.748
47260,"Virginia Beach-Norfolk-Newport News, VA-NC (Metropolitan Statistical Area)",99.98
47300,"Visalia, CA (Metropolitan Statistical Area)",82.107
47380,"Waco, TX (Metropolitan Statistical Area)",84.757
47460,"Walla Walla, WA (Metropolitan Statistical Area)",79.377
47580,"Warner Robins, GA (Metropolitan Statistical Area)",71.513
47900,"Washington-Arlington-Alexandria, DC-VA-MD-WV (Metropolitan Statistical Area)",156.292
47940,"Waterloo-Cedar Falls, IA (Metropolitan Statistical Area)",66.177
48060,"Watertown-Fort Drum, NY (Metropolitan Statistical Area)",81.357
48140,"Wausau-Weston, WI (Metropolitan Statistical Area)",69.306
48260,"Weirton-Steubenville, WV-OH (Metropolitan Statistical Area)",53.722
48300,"Wenatchee, WA (Metropolitan Statistical Area)",92.924
48540,"Wheeling, WV-OH (Metropolitan Statistical Area)",54.351
48620,"Wichita, KS (Metropolitan Statistical Area)",67.471
48660,"Wichita Falls, TX (Metropolitan Statistical Area)",61.548
48700,"Williamsport, PA (Metropolitan Statistical Area)",55.387
48900,"Wilmington, NC (Metropolitan Statistical Area)",95.751
49020,"Winchester, VA-WV (Metropolitan Statistical Area)",87.979
49180,"Winston-Salem, NC (Metropolitan Statistical Area)",69.595
49340,"Worcester, MA-CT (Metropolitan Statistical Area)",105.153
49420,"Yakima, WA (Metropolitan Statistical Area)",83.841
49620,"York-Hanover, PA (Metropolitan Statistical Area)",85.586
49660,"Youngstown-Warren-Boardman, OH-PA (Metropolitan Statistical Area)",52.108
49700,"Yuba City, CA (Metropolitan Statistical Area)",82.549
49740,"Yuma, AZ (Metropolitan Statistical Area)",59.091
